"Term"	"Definition"
"MMSE"	"Mini-Mental State Examination score (range: 0 = worst to 30 = best). A 30 point questionairre used to measure cognitive impairement. A score above 24 is considered normal. Lower scores may correlate with dementia although this is not true in every case."
"CDR"	"Clinical Dementia rating (0 = no impairment, 0.5 = questionable, 1 = mild, 2 = moderate, 3 = severe).  A clinical tool that measures relative dementia symptoms based on 6 domains (memory, orientation, judgment and problem solving, community affairs, home and hobbies, and personal care)"
"eTIV"	"Estimated total intracranical volume (mm3)"
"nWBV"	"Normalized whole-brain volume (%)"
"ASF"	"Atlas Scaling Factor (unitless)"
"M_F"	"Patient sex, Female is reprsesnted by a 1, Male is reprsented by a 2"
"EDUC"	"Years of Education"
"SES"	"Socioeconomic status, assesed by Hollingshead Four Factor Index Of Social Status, measures the social status of an indvidual based on 4 domains: marital status, retired/employed status, educational attainment, and occupational prestige. A score of 1 indicates high status, while 5 indictaes lowest status"
